{
  "$schema": "schemas/profile-parity-decision.schema.json",
  "schema_version": "profile-parity-decision.v1",
  "decision_id": "phase-08-eventing-profile-parity@1",
  "profiles": [
    {
      "profile_id": "six-layer-eventing@1",
      "role": "standalone PoC architecture profile",
      "mutable": true,
      "domain_behavior": "mandatory domain-event-flow@1",
      "eventing_responsibility": "independent routing, buffering, fan-out, retry, dead-letter, replay, ordering, observability, and cross-cloud transport"
    }
  ],
  "shared_domain_behavior_ref": "domain-event-flow@1",
  "comparison_rule": {
    "functional_parity_profiles": [
      "six-layer-eventing@1"
    ],
    "transport_semantics_may_differ": true
  },
  "legacy_flag_policy": {
    "flags": [
      "useEventChecking",
      "triggerNotificationWorkflow",
      "returnFeedbackToDevice"
    ],
    "new_profile_behavior": "reject",
    "historical_behavior": "optimizer_only_outside_runtime_profile_catalog"
  }
}
